{
  "dashboard_schema_version": 1,
  "generated_at": "2026-04-07T14:50:00",
  "league_settings": {
    "league_size": 10,
    "draft_position": 10,
    "scoring_type": "PPR",
    "ppr_value": 0.5,
    "risk_tolerance": "medium",
    "roster_spots": {
      "QB": 1,
      "RB": 2,
      "WR": 2,
      "TE": 1,
      "FLEX": 1,
      "DST": 1,
      "K": 1
    },
    "flex_weights": {
      "RB": 0.45,
      "WR": 0.45,
      "TE": 0.1
    },
    "bench_slots": 6
  },
  "decision_table": [
    {
      "player_name": "Test Player",
      "position": "RB",
      "draft_rank": 1,
      "simple_vor_rank": 1,
      "draft_score": 1.23,
      "simple_vor_proxy": 12.0,
      "availability_to_next_pick": 0.5,
      "expected_regret": 0.1,
      "upside_score": 0.7,
      "fragility_score": 0.2,
      "status": "available"
    }
  ],
  "recommendation_summary": [
    {
      "player_name": "Test Player"
    }
  ],
  "source_freshness": [
    {
      "source_name": "players",
      "status": "fresh",
      "override_used": false,
      "latest_expected_year": 2026,
      "latest_found_year": 2026
    }
  ],
  "analysis_provenance": {
    "overall_freshness": {
      "status": "fresh",
      "override_used": false,
      "warnings": []
    }
  },
  "decision_evidence": {
    "available": true,
    "status": "available",
    "headline": "Decision evidence is available for this board.",
    "freshness": {
      "status": "fresh",
      "override_used": false
    },
    "strategy_summary": [
      {
        "strategy": "draft_score",
        "mean_lineup_points": 100.0,
        "season_count": 1
      }
    ],
    "season_rows": [
      {
        "holdout_year": 2025,
        "draft_score_lineup_points": 100.0,
        "historical_vor_proxy_lineup_points": 90.0,
        "delta_lineup_points": 10.0
      }
    ],
    "top_disagreements": []
  },
  "war_room_visuals": {
    "schema_version": "war_room_visuals_v1",
    "contextual": {
      "key": "contextual_score",
      "label": "Board value score"
    },
    "baseline": {
      "key": "baseline_score",
      "label": "Simple VOR proxy"
    },
    "timing_frontier": {
      "available": true,
      "status": "available",
      "question": "Can I safely wait on this value, or do I need to pick now?",
      "reason": "",
      "candidates": [
        {
          "player_name": "Test Player",
          "position": "RB",
          "lane": "pick_now",
          "timing_survival": 0.5,
          "wait_regret": 0.1
        }
      ]
    },
    "positional_cliffs": {
      "available": true,
      "status": "available",
      "question": "Which positions are about to fall off if I wait?",
      "reason": "",
      "default_positions": [
        "RB"
      ],
      "positions": []
    },
    "comparative_explainer": {
      "available": true,
      "status": "available",
      "question": "Why does the contextual board differ from the baseline value view?",
      "reason": "",
      "contextual_label": "Board value score",
      "baseline_label": "Simple VOR proxy",
      "top_disagreements": []
    }
  },
  "model_overview": {
    "headline": "Model overview"
  },
  "metric_glossary": {},
  "runtime_controls": {
    "risk_tolerance_options": [
      "low",
      "medium",
      "high"
    ],
    "supported_scoring_presets": [
      "standard",
      "half_ppr",
      "ppr"
    ],
    "active_scoring_preset": "half_ppr"
  },
  "scoring_presets": {
    "standard": {
      "key": "standard",
      "label": "Standard (0.0 PPR)",
      "available": true,
      "scoring_type": "Standard",
      "ppr_value": 0.0,
      "league_settings": {
        "league_size": 10,
        "draft_position": 10,
        "scoring_type": "Standard",
        "ppr_value": 0.0,
        "risk_tolerance": "medium",
        "roster_spots": {
          "QB": 1,
          "RB": 2,
          "WR": 2,
          "TE": 1,
          "FLEX": 1,
          "DST": 1,
          "K": 1
        },
        "flex_weights": {
          "RB": 0.45,
          "WR": 0.45,
          "TE": 0.1
        },
        "bench_slots": 6
      },
      "decision_table": [
        {
          "player_name": "Test Player",
          "position": "RB"
        }
      ],
      "supporting_math": {
        "draft_score_mean": 1.0,
        "draft_score_std": 0.0,
        "availability_mean": 0.5,
        "top_draft_score": 1.0,
        "top_simple_vor_proxy": 1.0
      }
    },
    "half_ppr": {
      "key": "half_ppr",
      "label": "Half PPR (0.5)",
      "available": true,
      "scoring_type": "Half-PPR",
      "ppr_value": 0.5,
      "league_settings": {
        "league_size": 10,
        "draft_position": 10,
        "scoring_type": "Half-PPR",
        "ppr_value": 0.5,
        "risk_tolerance": "medium",
        "roster_spots": {
          "QB": 1,
          "RB": 2,
          "WR": 2,
          "TE": 1,
          "FLEX": 1,
          "DST": 1,
          "K": 1
        },
        "flex_weights": {
          "RB": 0.45,
          "WR": 0.45,
          "TE": 0.1
        },
        "bench_slots": 6
      },
      "decision_table": [
        {
          "player_name": "Test Player",
          "position": "RB"
        }
      ],
      "supporting_math": {
        "draft_score_mean": 1.0,
        "draft_score_std": 0.0,
        "availability_mean": 0.5,
        "top_draft_score": 1.0,
        "top_simple_vor_proxy": 1.0
      }
    },
    "ppr": {
      "key": "ppr",
      "label": "Full PPR (1.0)",
      "available": true,
      "scoring_type": "PPR",
      "ppr_value": 1.0,
      "league_settings": {
        "league_size": 10,
        "draft_position": 10,
        "scoring_type": "PPR",
        "ppr_value": 1.0,
        "risk_tolerance": "medium",
        "roster_spots": {
          "QB": 1,
          "RB": 2,
          "WR": 2,
          "TE": 1,
          "FLEX": 1,
          "DST": 1,
          "K": 1
        },
        "flex_weights": {
          "RB": 0.45,
          "WR": 0.45,
          "TE": 0.1
        },
        "bench_slots": 6
      },
      "decision_table": [
        {
          "player_name": "Test Player",
          "position": "RB"
        }
      ],
      "supporting_math": {
        "draft_score_mean": 1.0,
        "draft_score_std": 0.0,
        "availability_mean": 0.5,
        "top_draft_score": 1.0,
        "top_simple_vor_proxy": 1.0
      }
    }
  }
}
